"I.05.541","MR 108","partially quoted and translated","analysis of aorist meaning of hairéō, “to slay” as evidence for the suggestion that hairéō and halṓō are genuinely opposed pairs"
"O.15.034","MR 109","partially quoted and translated","evidence for contention that Odysseus’ voyage home is a passage through darkness to light, made in the company of one whose presence reflects the original role of nóos"
"O.15.296","MR 109","reference","evidence for contention that Odysseus’ voyage home is passage through darkness to light"
"I.08.742-743 / I.20.311 / I.21.226 / I.22.244","MR 110n51","reference","evidence for contention that Od. XVIII.265 is very old, as ἤ κεν and ἢ κεν is likely older than ἠέ κεν and ἢε κεν. "
"O.24.218","MR 110n51","reference","evidence for rarity of ἠέ κεν instead of ἤ κεν. Appears to appear only once"
"I.01.250-253","MR 113","quoted and translated","analysis of Nestor as the only Homeric man to outlive Glaucus’ dictum (Il. VI.46ff.). Suggests that Nestor’s survival is a remnant of his possible former mythological status as a god "
"O.03.245-256","MR 113","quoted and translated","analysis of Telemachus’ description of Nestor, who appears “immortal.” Suggests that Nestor’s apparent “immortality” is a remnant of his possible former mythological status as a god"
"I.11.761","MR 115","quoted","analysis of Nestor’s parallel to Zeus’ status among gods to his status among men. Suggests that Nestor’s apparent “immortality” is a remnant of his possible former mythological status as a god"
"O.03.120-122","MR 116","quoted and translated","citation of Nestor’s appraisal of Odysseus as the “shrewdest” of the Achaeans. Suggests that whereas Nestor symbolizes nóos, Odysseus makes nóos effective"
"O.11.510-512","MR 116","quoted and translated","citation of Odysseus’s appraisal of himself and Nestor as the foremost Greek counselors. Suggests that whereas Nestor symbolizes nóos, Odysseus makes nóos effective"
"I.18.105-106","MR 117","quoted and translated","citation of Achilles’ appraisal of himself as not the best in the assembly. Suggests that Achilles is as dissociated from nóos as he is from néomai"
"O.11.485-486","MR 117","reference","reference to Odysseus’s remarks that Achilles is even a king in the underworld"
"O.11.488","MR 117","reference","reference to Achilles’ response that he would rather be a serf in life that a king amongst the dead – a reference to Achilles’ juxtaposition with Odysseus (the one who has nóos will return, the one who does not will not)"
"O.11.473-476","MR 118","analysis of antithetical fates of Achilles and Odysseus as contrasted by the by the “wits” of Odysseus and Achilles’ fate amongst the “mindless” dead"
"I.19.216","MR 118n1","quoted and translated","example of the contrast between Odysseus’ nóēma and Achilles’ strength in Odysseus’ address to Achilles before the final battle of the Iliad"
"I.11.786","MR 118n1","reference","example of the contrast between Achilles’ bíē and the greater age and superior counsel of Patroclus. Compare to Il. XIX.216"
"I.23.144-151","MR 119","analysis of Achilles’ address to the river Spercheius. The juxtaposition of Peleus’ intention with the theme of Achilles’ return underscores the latent connection of loss of “mind” with Achilles’ loss of “return” "
"I.18.324-332","MR 119-120","quoted and translated","analysis of Achilles reference to nóēma, which consists in his own nóstos, and which will remain unaccomplished precisely because he will not “return”"
"I.01.352","MR 121","quoted and translated","example of Achilles’ knowledge that he is fated to have a short life. Issue of free will and fate is ambiguous when compared to Il. XIX.412, Il. XVIII.59-62"
"I.09.412","MR 121","reference","Example of Achilles’ indecision about remaining in Troy for to achieve kléos or to achieve his nóstos. Issue of free will and fate is ambiguous when compared to Il. I.352 and Il. XVIII.89-96"
"I.18.059-062","MR 121","quoted and translated","analysis of Thetis’ speech to Nereids, where she schematizes Achilles’ fate in the following terms: (1) Achilles will not return because (2) (implicit) this is his fate. Compare to conception of Achilles’ fate in Il. XIX.412, Il. XVIII.89-96, Il. I.352"
"I.18.089-096","MR 122","quoted and translated","analysis of Achilles’ and Thetis’ speech. Change in the sequence of ideas makes it appear that Achilles has chosen what has already been fated. Compare to Il. XIX.412, Il. XVIII.59-62, Il. I.352"
"I.18.101 ","MR 123","quoted and translated","reference to Achilles’ apparent recognition of the fate his mother, Thetis, has revealed"
"I.18.114","MR 123","quoted and translated","analysis of Achilles’ perception of fate as anterior to will"
"I.18.115-116","MR 123","analysis of Achilles’ acknowledgement of fate, which suggests that Achilles’ resolve to die is also a result of his own lack of “mind” "
"I.23.149-150","MR 124","quoted and translated","analysis of Achilles’ acknowledgement of fate, which suggests that Achilles’ resolve to die is also a result of his own lack of “mind”"
"O.11.302-304 / I.03.243-244","MR 141n43","quoted and translated","brief analysis of the Dioscuri, who as a combination of immortal and mortal elements, experience an alternation between life and death"
"I.24.328","MR 153n1","quoted and translated","cited as evidence for the well recognized notion that Priam’s ransom of Hector in Iliad XXIV is represented as a journey to the underworld and a consequent “return to life”"
"I.24.343","MR 153n2","reference","reference to same lines in similar thematic connection in Il. XXIV.328"
"I.24.350ff","MR 153","reference","reference to location and time (sunset) of Herme’s meeting with Priam, the tomb if Ilus. Indication of Priam’s ransom of Hector as a to the underworld and consequent ‘return to life’"
"I.24.694ff","MR 153","reference","reference to time (sunrise) of Priam’s return from the ransom of Hector. Indication of a journey to the underworld and consequent ‘return to life’"
"I.24.354 / I.24.358 / I.24.366-367 / I.24.374-377","MR 154","quoted and translated","quoted and translated; analysis of the role of nóos in the encounter between Priam and Hermes"
"I.24.547","MR 155","quoted and translated","reference to the connection between the captured horses of Diomedes and Odysseus and the ‘the rays of the sun’"
"I.24.281-282","MR 155","reference","brief analysis of the importance of ‘returning’ in this scene"
"I.24.509","MR 156","partially quoted and translated","brief analysis of the importance of ‘returning’ in this scene, as indicated by Athena’s words to Diomedes, nóstou dḕmnēsat"
"I.24.224-226 / I.24.246-247","MR 156","quoted and translated","analysis of the significance of nóos and néomai in the speech of Diomedes"
