"urn:cts:greekLit:tlg0012.tlg001:1.35","urn:cts:ahcip:DouglasFrame.HippotaNestor:s_372.n_53","reference","in the context of discussing ērato and Arētē"
"urn:cts:greekLit:tlg0012.tlg001:1.43-1.52","urn:cts:ahcip:DouglasFrame.HippotaNestor:s_253.n_153","reference","comment on Apollo’s arrows indicating death by disease, in the context of discussing O.07.063-066"
"urn:cts:greekLit:tlg0012.tlg001:1.247-1.253","urn:cts:ahcip:DouglasFrame.HippotaNestor:s_10.n_2","quoted and translated","discussion of the motif of Nestor’s three-generation lifespan in both the Iliad and the Odyssey"
"urn:cts:greekLit:tlg0012.tlg001:1.272","urn:cts:ahcip:DouglasFrame.HippotaNestor:s_608.n_202","quoting and translating part of the line","commentary on Nestor’s comparison between the heroes of his youth and those at Troy as possible model for comparisons of men of today with heroes at Troy"
"urn:cts:greekLit:tlg0012.tlg001:1.578-1.579","urn:cts:ahcip:DouglasFrame.HippotaNestor:s_693.n_82","reference","discussing Hephaistos’ being the son of Hera and Zeus in Homer, in contrast to in Hesiod"
"urn:cts:greekLit:tlg0012.tlg001:2.33-2.34","urn:cts:ahcip:DouglasFrame.HippotaNestor:s_159.n_52","part of line quoted and translated","commentary on the dream sent by Zeus to Agamemnon in the form of Nestor"
"urn:cts:greekLit:tlg0012.tlg001:2.111-2.115","urn:cts:ahcip:DouglasFrame.HippotaNestor:s_187.n_82","reference","contrast between Nestor who affirms the positive sign from Zeus regarding the Achaeans return and Agamemnon who denies it"
"urn:cts:greekLit:tlg0012.tlg001:2.112","urn:cts:ahcip:DouglasFrame.HippotaNestor:s_188.n_83","reference","comment on the formulaic language of Zeus’ promising and nodding in assent in response to prayer (of returning from Troy)"
"urn:cts:greekLit:tlg0012.tlg001:2.115","urn:cts:ahcip:DouglasFrame.HippotaNestor:s_335","reference","in the context of interpreting Menelaos as “he who incites the warfolk”; example of laos as referring to one’s own even with ōlese"
"urn:cts:greekLit:tlg0012.tlg001:2.164","urn:cts:ahcip:DouglasFrame.HippotaNestor:s_186.n_80","reference","commentary on Odysseus’ restraining and Nestor’s inciting the Achaeans, corresponding to the contrast between them on their nostos (as the mortal and immortal twins, respectively)"
"urn:cts:greekLit:tlg0012.tlg001:2.180","urn:cts:ahcip:DouglasFrame.HippotaNestor:s_186.n_80","reference","commentary on Odysseus’ restraining and Nestor’s inciting the Achaeans, corresponding to the contrast between them on their nostos (as the mortal and immortal twins, respectively)"
"urn:cts:greekLit:tlg0012.tlg001:2.189","urn:cts:ahcip:DouglasFrame.HippotaNestor:s_186.n_80","reference","commentary on Odysseus’ restraining and Nestor’s inciting the Achaeans, corresponding to the contrast between them on their nostos (as the mortal and immortal twins, respectively)"
"urn:cts:greekLit:tlg0012.tlg001:2.198-2.206","urn:cts:ahcip:DouglasFrame.HippotaNestor:s_186.n_80","reference","commentary on Odysseus’ restraining and Nestor’s inciting the Achaeans, corresponding to the contrast between them on their nostos (as the mortal and immortal twins, respectively)"
"urn:cts:greekLit:tlg0012.tlg001:2.221","urn:cts:ahcip:DouglasFrame.HippotaNestor:s_186.n_80","reference","commentary on Odysseus’ restraining and Nestor’s inciting the Achaeans, corresponding to the contrast between them on their nostos (as the mortal and immortal twins, respectively)"
"urn:cts:greekLit:tlg0012.tlg001:2.236","urn:cts:ahcip:DouglasFrame.HippotaNestor:s_39.n_69","reference","in the context of discussing the interpretation of Nestor’s name and the meaning of forms from the root *nes- as “safe return home” or without “home” where it needed to be specified"
"urn:cts:greekLit:tlg0012.tlg001:2.265-2.269","urn:cts:ahcip:DouglasFrame.HippotaNestor:s_186.n_80","reference","commentary on Odysseus’ restraining and Nestor’s inciting the Achaeans, corresponding to the contrast between them on their nostos (as the mortal and immortal twins, respectively)"
"urn:cts:greekLit:tlg0012.tlg001:2.299-2.300","urn:cts:ahcip:DouglasFrame.HippotaNestor:s_186.n_81","quoted and translated","in the context of discussing the contrast between Odysseus and Nestor in terms of their referring to signs from gods (Odysseus recalls one interpreted by Calchas, Nestor one he saw for himself)"
"urn:cts:greekLit:tlg0012.tlg001:2.344-2.345","urn:cts:ahcip:DouglasFrame.HippotaNestor:s_186.n_80","reference","commentary on Odysseus’ restraining and Nestor’s inciting the Achaeans, corresponding to the contrast between them on their nostos (as the mortal and immortal twins, respectively)"
"urn:cts:greekLit:tlg0012.tlg001:2.344-2.350","urn:cts:ahcip:DouglasFrame.HippotaNestor:s_188.n_83","quoted and translated","comment on the formulaic language of Zeus’ promising and nodding in assent in response to prayer (of returning from Troy) and the variation on it in this passage"
"urn:cts:greekLit:tlg0012.tlg001:2.348-2.349","urn:cts:ahcip:DouglasFrame.HippotaNestor:s_186","translation of part of line","in the context of discussing the contrast between Odysseus and Nestor in terms of their referring to signs from gods (Odysseus recalls one interpreted by Calchas, Nestor one he saw for himself)"
"urn:cts:greekLit:tlg0012.tlg001:2.350-2.353","urn:cts:ahcip:DouglasFrame.HippotaNestor:s_186","quoted and translated","in the context of discussing the contrast between Odysseus and Nestor in terms of their referring to signs from gods (Odysseus recalls one interpreted by Calchas, Nestor one he saw for himself)"
"urn:cts:greekLit:tlg0012.tlg001:2.365","urn:cts:ahcip:DouglasFrame.HippotaNestor:s_335","reference in the context of interpreting Menelaos as “he who incites the warfolk”","example of laos as referring to one’s own in contexts where there is a contrast between “leader(s)” and those who “follow”"
"urn:cts:greekLit:tlg0012.tlg001:2.494-2.510","urn:cts:ahcip:DouglasFrame.HippotaNestor:s_479.n_275","reference","discussion of the singularity of the Athenian entry in the Catalogue of Ships and comparison with other entries (here, Boeotia)"
"urn:cts:greekLit:tlg0012.tlg001:2.511-2.516","urn:cts:ahcip:DouglasFrame.HippotaNestor:s_479.n_275","reference","discussion of the singularity of the Athenian entry in the Catalogue of Ships and comparison with other entries (here, Orkhomenos)"
"urn:cts:greekLit:tlg0012.tlg001:2.536-2.545","urn:cts:ahcip:DouglasFrame.HippotaNestor:s_479.n_275","reference","discussion of the singularity of the Athenian entry in the Catalogue of Ships and comparison with other entries (here, Euboea)"
"urn:cts:greekLit:tlg0012.tlg001:2.546-2.551","urn:cts:ahcip:DouglasFrame.HippotaNestor:s_345.n_6","reference","discussion of evidence for Athena and Erechtheus as a pair, and this passage from the Catalogue of Ships as reflecting later circumstances than O.07.078-081"
"urn:cts:greekLit:tlg0012.tlg001:2.546-2.551","urn:cts:ahcip:DouglasFrame.HippotaNestor:s_409","references","discussion of the temple of Athena and Erechtheus in Athens and the latter’s removal from it so that it was only Athena Polias’, and the passage, correctly understood, as presupposing that the shrine of Erechtheus was separate from the temple of Athena"
"urn:cts:greekLit:tlg0012.tlg001:2.546-2.551","urn:cts:ahcip:DouglasFrame.HippotaNestor:s_412","reference","discussion of the temple of Athena and Erechtheus in Athens and the latter’s removal from it so that it was only Athena Polias’, and the passage as reflecting the state of affairs after Erechtheus had taken over Poseidon’s shrine"
"urn:cts:greekLit:tlg0012.tlg001:2.546-2.551","urn:cts:ahcip:DouglasFrame.HippotaNestor:s_445","quoted and translated","discussion of Erechtheus temple and yearly sacrifices"
"urn:cts:greekLit:tlg0012.tlg001:2.546-2.551","urn:cts:ahcip:DouglasFrame.HippotaNestor:s_466.n_243","reference","the passage as reflecting Erechtheus birth from Earth instead of from Athena"
"urn:cts:greekLit:tlg0012.tlg001:2.546-2.556","urn:cts:ahcip:DouglasFrame.HippotaNestor:s_394","quoted and translated","discussion of relationship of Athena (Polias) and Erechtheus, and contrast with their representation in O.07"
"urn:cts:greekLit:tlg0012.tlg001:2.547","urn:cts:ahcip:DouglasFrame.HippotaNestor:s_409.n_117","quoting and translating part of the line","discussion of interpreting the temple mentioned as Erechtheus’, not Athena’s"
"urn:cts:greekLit:tlg0012.tlg001:2.547","urn:cts:ahcip:DouglasFrame.HippotaNestor:s_482","reference","comment on Erechtheus epithet megalētōr as one used only of heroic warriors (to convey the warlike nature of Athenians)"
"urn:cts:greekLit:tlg0012.tlg001:2.547-2.549","urn:cts:ahcip:DouglasFrame.HippotaNestor:s_411","reference","comment on Erechtheus’ relocation as described in terms of Athena’s own primordial act, and as reflecting their new cult relationship"
"urn:cts:greekLit:tlg0012.tlg001:2.547-2.549","urn:cts:ahcip:DouglasFrame.HippotaNestor:s_460","quoted and translated","discussion of the different versions of Erectheus’ myth and Athena’s role in the newer version as given in the Catalogue of Ships"
"urn:cts:greekLit:tlg0012.tlg001:2.548","urn:cts:ahcip:DouglasFrame.HippotaNestor:s_460","reference","comment on Athena as kourotrophos as compatible with her virginity and how her larger role as a mother goddess is limited here"
"urn:cts:greekLit:tlg0012.tlg001:2.548","urn:cts:ahcip:DouglasFrame.HippotaNestor:s_482","reference","comment dios thugatēr as Athena’s epithet here as marking her as a war goddess, not the old Athenian mother goddess (to convey the warlike nature of Athenians)"
"urn:cts:greekLit:tlg0012.tlg001:2.549","urn:cts:ahcip:DouglasFrame.HippotaNestor:s_395","quoting part of the line","comment on interpreting eō en pioni nēō as “in his own rich temple” (i.e. Erechtheus’ as opposed to Athena’s)"
"urn:cts:greekLit:tlg0012.tlg001:2.549","urn:cts:ahcip:DouglasFrame.HippotaNestor:s_409.n_117","quoting part of the line","comment on interpreting eō en pioni nēō as “in his own rich temple” (i.e. Erechtheus’ as opposed to Athena’s)"
"urn:cts:greekLit:tlg0012.tlg001:2.549","urn:cts:ahcip:DouglasFrame.HippotaNestor:s_410.n_117","quoting part of the line","comment on interpreting eō en pioni nēō as “in his own rich temple” (i.e. Erechtheus’ as opposed to Athena’s)"
"urn:cts:greekLit:tlg0012.tlg001:2.549","urn:cts:ahcip:DouglasFrame.HippotaNestor:s_446.n_193","reference","comment on the ambiguity of the pronouns (his or her temple) and how the passage does therefore not openly conflict with the old situation between Erechtheus and Athena"
"urn:cts:greekLit:tlg0012.tlg001:2.549-2.551","urn:cts:ahcip:DouglasFrame.HippotaNestor:s_395","reference","discussion of relationship of Athena (Polias) and Erechtheus, and contrast with their representation in O.07"
"urn:cts:greekLit:tlg0012.tlg001:2.550","urn:cts:ahcip:DouglasFrame.HippotaNestor:s_446.n_193","reference","comment on the ambiguity of the pronouns (his or her temple) and how the passage does therefore not openly conflict with the old situation between Erechtheus and Athena"
"urn:cts:greekLit:tlg0012.tlg001:2.550-2.551","urn:cts:ahcip:DouglasFrame.HippotaNestor:s_414.n_130","reference","comparison of sacrifices to Poseidon Erechtheus in Euripides and Iliad"
"urn:cts:greekLit:tlg0012.tlg001:2.550-2.551","urn:cts:ahcip:DouglasFrame.HippotaNestor:s_476","quoted and translated","comparison of this passage on sacrifices to Erechtheus with Hymn to Demeter 259-267 (cult of Demophoon)"
"urn:cts:greekLit:tlg0012.tlg001:2.550-2.551","urn:cts:ahcip:DouglasFrame.HippotaNestor:s_476.n_268","reference","comparison of this passage on sacrifices to Erechtheus with Hymn to Demeter 259-267 (cult of Demophoon)"
"urn:cts:greekLit:tlg0012.tlg001:2.550-2.551","urn:cts:ahcip:DouglasFrame.HippotaNestor:s_481.n_278","reference","arguments that only parts of the Athenian catalogue have an Athenian origin"
"urn:cts:greekLit:tlg0012.tlg001:2.552-2.556","urn:cts:ahcip:DouglasFrame.HippotaNestor:s_483","quoted and translated","analysis of the Athenian entry in the Catalogue of Ships as conveying the warlike nature of the Athenians"
"urn:cts:greekLit:tlg0012.tlg001:2.553-2.555","urn:cts:ahcip:DouglasFrame.HippotaNestor:s_481.n_278","reference","arguments that only parts of the Athenian catalogue have an Athenian origin"
"urn:cts:greekLit:tlg0012.tlg001:2.557-2.558","urn:cts:ahcip:DouglasFrame.HippotaNestor:s_322","references","alleged interpolations in the Catalogue of the Ships in antiquity and the Megarians alternative version with no mention of Athens"
"urn:cts:greekLit:tlg0012.tlg001:2.557-2.558","urn:cts:ahcip:DouglasFrame.HippotaNestor:s_322.n_227","references","alleged interpolations in the Catalogue of the Ships in antiquity and the Megarians alternative version with no mention of Athens"
"urn:cts:greekLit:tlg0012.tlg001:2.557-2.558","urn:cts:ahcip:DouglasFrame.HippotaNestor:s_477.n_270","quoted and translated","on the Athenian forgery in support of Athens’ claim to Salamis"
"urn:cts:greekLit:tlg0012.tlg001:2.557-2.558","urn:cts:ahcip:DouglasFrame.HippotaNestor:s_669.n_46","reference","on Solon’s alleged addition to the Catalogue of Ships to support Athens’ claim to Salamis and taking Homeric poems literally in matters of geography and politics in antiquity"
"urn:cts:greekLit:tlg0012.tlg001:2.558","urn:cts:ahcip:DouglasFrame.HippotaNestor:s_321","references","alleged interpolations in the Catalogue of Ships in antiquity"
"urn:cts:greekLit:tlg0012.tlg001:2.558","urn:cts:ahcip:DouglasFrame.HippotaNestor:s_321.n_225","references","alleged interpolations in the Catalogue of Ships in antiquity"
"urn:cts:greekLit:tlg0012.tlg001:2.558","urn:cts:ahcip:DouglasFrame.HippotaNestor:s_322.n_226","references","alleged interpolations in the Catalogue of Ships in antiquity"
"urn:cts:greekLit:tlg0012.tlg001:2.558","urn:cts:ahcip:DouglasFrame.HippotaNestor:s_511","reference","attribution of the interpolation in the Catalogue of Ships to both Solon and Peisistratos"
"urn:cts:greekLit:tlg0012.tlg001:2.569-2.578","urn:cts:ahcip:DouglasFrame.HippotaNestor:s_479.n_277","quoted and translated","on Agamemnon’s Mycenae as not standing alone but as one of twelve towns in its entry in the Catalogue of Ships"
"urn:cts:greekLit:tlg0012.tlg001:2.573","urn:cts:ahcip:DouglasFrame.HippotaNestor:s_321.n_225","reference","example of an attested interpolation of one letter (Gonoessan for Donoessan)"
"urn:cts:greekLit:tlg0012.tlg001:2.575","urn:cts:ahcip:DouglasFrame.HippotaNestor:s_666.n_35","reference","discussion of location of Aigialos"
"urn:cts:greekLit:tlg0012.tlg001:2.578","urn:cts:ahcip:DouglasFrame.HippotaNestor:s_335","reference in the context of interpreting Menelaos as “he who incites the warfolk”","example of laos as referring to one’s own in contexts where there is a contrast between “leader(s)” and those who “follow”"
"urn:cts:greekLit:tlg0012.tlg001:2.580","urn:cts:ahcip:DouglasFrame.HippotaNestor:s_336","reference in the context of interpreting Menelaos as “he who incites the warfolk”","analysis of how alive the meaning of the name Agelaos was based on the collocation of agein with laos"
"urn:cts:greekLit:tlg0012.tlg001:2.591-2.592","urn:cts:ahcip:DouglasFrame.HippotaNestor:s_654.n_4","quoted and translated","comparison of the geography in I.11.722-736 with that in the passage (esp. regarding the Minyan river, Arene, and Thryon)"
"urn:cts:greekLit:tlg0012.tlg001:2.591-2.592","urn:cts:ahcip:DouglasFrame.HippotaNestor:s_676","quoted and translated","comparison of the geography in Hom. Hymn to Apollo 418424 with that in the passage (esp. regarding the Alpheios river)"
"urn:cts:greekLit:tlg0012.tlg001:2.592","urn:cts:ahcip:DouglasFrame.HippotaNestor:s_652.n_3","reference","comparison of the geography in I.11.711-713 with that in the line (esp. regarding the identification of Thryoessa and Thryon in the two passages)"
"urn:cts:greekLit:tlg0012.tlg001:2.592","urn:cts:ahcip:DouglasFrame.HippotaNestor:s_664.n_30","reference","comparison of the geography in I.11.711 with that in the line (esp. regarding Thryoessa and Thryon in the two passages)"
"urn:cts:greekLit:tlg0012.tlg001:2.592","urn:cts:ahcip:DouglasFrame.HippotaNestor:s_668.n_40","quotation","identification of Thryon and Epitalion, and Strabo’s alternative interpretation of the line according to which Epitalion was Aipu and Thryon the ford of Alpheios rather than a town"
"urn:cts:greekLit:tlg0012.tlg001:2.592","urn:cts:ahcip:DouglasFrame.HippotaNestor:s_668.n_43","reference","analysis of the location of Thryon/identification with Epitalion"
"urn:cts:greekLit:tlg0012.tlg001:2.592","urn:cts:ahcip:DouglasFrame.HippotaNestor:s_680","reference","analysis of the Hom. Hymns’ quoting the Homeric poems (here, Hom. Hymn to Apollo 423 quoting this line)"
"urn:cts:greekLit:tlg0012.tlg001:2.592","urn:cts:ahcip:DouglasFrame.HippotaNestor:s_768","quoted and translated","analysis of a pattern violating Hermann’s bridge and this feature in the Hom. Hymn to Apollo’s quoting this line (and contra Richard Martin 2000a)"
"urn:cts:greekLit:tlg0012.tlg001:2.593","urn:cts:ahcip:DouglasFrame.HippotaNestor:s_667","quoting and translating part of the line","identification of Thryoessa of I.11 with Thryon of this line"
"urn:cts:greekLit:tlg0012.tlg001:2.596","urn:cts:ahcip:DouglasFrame.HippotaNestor:s_116.n_20","reference","analysis of the location of Oichalia (and connections to Makhaon and Podaleirios), in the context of the analysis of Thessaly’s and Messenia’s claims to be Makhaon’s homeland"
"urn:cts:greekLit:tlg0012.tlg001:2.615-2.619","urn:cts:ahcip:DouglasFrame.HippotaNestor:s_663.n_29","quoted and translated","analysis of the Epeian entry in the Catalogue of Ships and comparison with the geography in I.11"
"urn:cts:greekLit:tlg0012.tlg001:2.615-2.624","urn:cts:ahcip:DouglasFrame.HippotaNestor:s_132.n_27","reference","analysis of Amarynkeus’ and Augeias’ “age”/order (in terms of generations) and comparison with I.11 and I.23 regarding them"
"urn:cts:greekLit:tlg0012.tlg001:2.616-2.617","urn:cts:ahcip:DouglasFrame.HippotaNestor:s_663.n_29","reference","analysis of the construction in combination of the construction in I.02.617 as suspect, therefore making its relationship to I.11.757 uncertain (where the expansion seems to be based on I.02.617)"
"urn:cts:greekLit:tlg0012.tlg001:2.617","urn:cts:ahcip:DouglasFrame.HippotaNestor:s_664.n_30","reference","comparison of the line with I.11.757 and the geography in both passages"
"urn:cts:greekLit:tlg0012.tlg001:2.617","urn:cts:ahcip:DouglasFrame.HippotaNestor:s_753","reference","analysis of the location of the Olenian Rock and other features of the geography in the passage and I.11"
"urn:cts:greekLit:tlg0012.tlg001:2.620-2.621","urn:cts:ahcip:DouglasFrame.HippotaNestor:s_111.n_10","reference","comment on the names of the Molione and comparison with Hesiod fr. 17a14-16 MW"
"urn:cts:greekLit:tlg0012.tlg001:2.622","urn:cts:ahcip:DouglasFrame.HippotaNestor:s_132.n_27","reference","analysis of Amarynkeus’ and Augeias’ “age”/order (in terms of generations), here the possibility that Amarunkeidēs in the line in question means “descendant of Amarynkeus” rather than “son of Amarynkeus”"
"urn:cts:greekLit:tlg0012.tlg001:2.629","urn:cts:ahcip:DouglasFrame.HippotaNestor:s_39.n_70","reference","discussion of asmenos as root aorist participle with zero-grade of the root *nes and García Ramón’s argument that apenassato in this line is from neomai, not naiō"
"urn:cts:greekLit:tlg0012.tlg001:2.671-2.675","urn:cts:ahcip:DouglasFrame.HippotaNestor:s_480","quoted and translated","contrast between the entries for Sume (singled out for its weakness and that of its leader Nireus) and for Athens, both of which name only one town"
"urn:cts:greekLit:tlg0012.tlg001:2.675","urn:cts:ahcip:DouglasFrame.HippotaNestor:s_335","reference in the context of interpreting Menelaos as “he who incites the warfolk”","example of laos as referring to one’s own in contexts where there is a contrast between “leader(s)” and those who “follow”"
"urn:cts:greekLit:tlg0012.tlg001:2.708","urn:cts:ahcip:DouglasFrame.HippotaNestor:s_335","reference in the context of interpreting Menelaos as “he who incites the warfolk”","example of laos as referring to one’s own in contexts where there is a contrast between “leader(s)” and those who “follow”"
"urn:cts:greekLit:tlg0012.tlg001:2.729-2.732","urn:cts:ahcip:DouglasFrame.HippotaNestor:s_114.n_18","quoted and translated","analysis of Makhaon and Podaleirios as twins and comparison with Nestor (and Periklymenos)"
"urn:cts:greekLit:tlg0012.tlg001:2.730","urn:cts:ahcip:DouglasFrame.HippotaNestor:s_116.n_20","reference","analysis of the location of Oichalia (and connections to Makhaon and Podaleirios)"
"urn:cts:greekLit:tlg0012.tlg001:2.748-2.755","urn:cts:ahcip:DouglasFrame.HippotaNestor:s_707.n_117","quoted and translated","analysis of the location of the Ainianes and the Perrhaiboi in the Iliad and the Hom. Hymn to Apollo"
"urn:cts:greekLit:tlg0012.tlg001:2.753-2.754","urn:cts:ahcip:DouglasFrame.HippotaNestor:s_708.n_118","reference","comparison of Strabo and Homer on the waters of Peneios and Titaresios not mixing"
"urn:cts:greekLit:tlg0012.tlg001:2.756-2.759","urn:cts:ahcip:DouglasFrame.HippotaNestor:s_479.n_275","reference","discussion of the singularity of the Athenian entry in the Catalogue of Ships and comparison with other entries (here, Boeotia)"
"urn:cts:greekLit:tlg0012.tlg001:2.763","urn:cts:ahcip:DouglasFrame.HippotaNestor:s_211.n_111","reference","attitude towards females in the chariot race compared with that of the role of female in the failure of Agamemnon’s (and Menelaus’) nostos"
"urn:cts:greekLit:tlg0012.tlg001:2.779","urn:cts:ahcip:DouglasFrame.HippotaNestor:s_335","reference in the context of interpreting Menelaos as “he who incites the warfolk”","this line as one of the counterexamples for identifying unmodified laos as one’s own"
"urn:cts:greekLit:tlg0012.tlg001:2.818","urn:cts:ahcip:DouglasFrame.HippotaNestor:s_335","reference in the context of interpreting Menelaos as “he who incites the warfolk”","example of laos as referring to one’s own in contexts where there is a contrast between “leader(s)” and those who “follow”"
"urn:cts:greekLit:tlg0012.tlg001:2.864-2.866","urn:cts:ahcip:DouglasFrame.HippotaNestor:s_578.n_140","quoted and translated","analysis of the Gygaean lake (name, location) in the context of discussing the Homeric poems’ awareness of the Lydians and Gyges"
"urn:cts:greekLit:tlg0012.tlg001:2.864-2.866","urn:cts:ahcip:DouglasFrame.HippotaNestor:s_619.n_236","reference","analysis of the Homeric references to the Lydians in the context of discussing the performance of the Homeric poems at the Panionia"
"urn:cts:greekLit:tlg0012.tlg001:2.865","urn:cts:ahcip:DouglasFrame.HippotaNestor:s_631","reference","analysis of Iliadic references to “the lake of Gyges”"
"urn:cts:greekLit:tlg0012.tlg001:2.867-2.869","urn:cts:ahcip:DouglasFrame.HippotaNestor:s_619.n_236","quoted and translated","analysis of the Homeric reference to Cape Mykale, the site of the future Panionia, in the context of discussing the performance of the Homeric poems at the Panionia"
"urn:cts:greekLit:tlg0012.tlg001:2.867-2.869","urn:cts:ahcip:DouglasFrame.HippotaNestor:s_646","reference","analysis of an Ionian Athens in I.13.685-691 as fitting in with a Carian Miletus in the Trojan Catalogue of Ships"
"urn:cts:greekLit:tlg0012.tlg001:2.867-2.875","urn:cts:ahcip:DouglasFrame.HippotaNestor:s_619.n_236","reference","analysis of the Homeric references to the Lydians in the context of discussing the performance of the Homeric poems at the Panionia"
"urn:cts:greekLit:tlg0012.tlg001:2.876-2.877","urn:cts:ahcip:DouglasFrame.HippotaNestor:s_619.n_236","reference","analysis of the Homeric references to the Lydians in the context of discussing the performance of the Homeric poems at the Panionia"
"urn:cts:greekLit:tlg0012.tlg001:3.52","urn:cts:ahcip:DouglasFrame.HippotaNestor:s_223.n_127","quoted and translated","example of possibility that in places Menelaos’s name was interpreted differently from the standard “he who reminds the warfolk”"
"urn:cts:greekLit:tlg0012.tlg001:3.144","urn:cts:ahcip:DouglasFrame.HippotaNestor:s_79.n_180","reference","analysis of the suggestion of Helen’s earlier abduction, otherwise not told, in the Iliad"
"urn:cts:greekLit:tlg0012.tlg001:3.146","urn:cts:ahcip:DouglasFrame.HippotaNestor:s_332","reference","analysis of Hector and Polydamas as treated as virtual twins in the Iliad, though not actually even brothers (as this line about Polydamas’ father shows)"
"urn:cts:greekLit:tlg0012.tlg001:3.237","urn:cts:ahcip:DouglasFrame.HippotaNestor:s_75.n_162","reference","epithets of Castor and Polydeuces and how they are distinguished from one another"
"urn:cts:greekLit:tlg0012.tlg001:3.237","urn:cts:ahcip:DouglasFrame.HippotaNestor:s_84","reference","epithet of Castor as “horse-breaking” to distinguish him from Polydeuces and parallels from Indic and the IE twin myth"
"urn:cts:greekLit:tlg0012.tlg001:3.243-3.244","urn:cts:ahcip:DouglasFrame.HippotaNestor:s_80","quoted and translated","analysis of Castor and Polydeuces as represented in the Iliad (as dead heroes)"
"urn:cts:greekLit:tlg0012.tlg001:4.73","urn:cts:ahcip:DouglasFrame.HippotaNestor:s_26.n_37","reference","analysis of (ep)otrunō in its connections with menō"
"urn:cts:greekLit:tlg0012.tlg001:4.91","urn:cts:ahcip:DouglasFrame.HippotaNestor:s_335","reference in the context of interpreting Menelaos as “he who incites the warfolk”","example of laos as referring to one’s own in contexts where there is a contrast between “leader(s)” and those who “follow”"
